{
  "format": "Permansson.App.FinitePerturbation.v1",
  "baseline": {
    "format": "Permansson.App.FiniteStrategicWorld.v1",
    "states": {
      "strategic": [
        "s0",
        "s1"
      ],
      "world": [
        "x0",
        "x1"
      ],
      "actions": [
        "go"
      ]
    },
    "feasible": [
      {
        "s": "s0",
        "x": "x0",
        "actions": [
          "go"
        ]
      },
      {
        "s": "s0",
        "x": "x1",
        "actions": [
          "go"
        ]
      },
      {
        "s": "s1",
        "x": "x0",
        "actions": [
          "go"
        ]
      },
      {
        "s": "s1",
        "x": "x1",
        "actions": [
          "go"
        ]
      }
    ],
    "alpha": [
      {
        "s": "s0",
        "x": "x0",
        "weights": {
          "go": "1"
        }
      },
      {
        "s": "s0",
        "x": "x1",
        "weights": {
          "go": "1"
        }
      },
      {
        "s": "s1",
        "x": "x0",
        "weights": {
          "go": "1"
        }
      },
      {
        "s": "s1",
        "x": "x1",
        "weights": {
          "go": "1"
        }
      }
    ],
    "P": [
      {
        "s": "s0",
        "x": "x0",
        "a": "go",
        "weights": {
          "x0": "1/3",
          "x1": "2/3"
        }
      },
      {
        "s": "s0",
        "x": "x1",
        "a": "go",
        "weights": {
          "x0": "1",
          "x1": "0"
        }
      },
      {
        "s": "s1",
        "x": "x0",
        "a": "go",
        "weights": {
          "x0": "0",
          "x1": "1"
        }
      },
      {
        "s": "s1",
        "x": "x1",
        "a": "go",
        "weights": {
          "x0": "0",
          "x1": "1"
        }
      }
    ],
    "U": [
      {
        "s": "s0",
        "x": "x0",
        "a": "go",
        "xp": "x0",
        "weights": {
          "s0": "1",
          "s1": "0"
        }
      },
      {
        "s": "s0",
        "x": "x0",
        "a": "go",
        "xp": "x1",
        "weights": {
          "s0": "1/2",
          "s1": "1/2"
        }
      },
      {
        "s": "s0",
        "x": "x1",
        "a": "go",
        "xp": "x0",
        "weights": {
          "s0": "0",
          "s1": "1"
        }
      },
      {
        "s": "s0",
        "x": "x1",
        "a": "go",
        "xp": "x1",
        "weights": {
          "s0": "0",
          "s1": "1"
        }
      },
      {
        "s": "s1",
        "x": "x0",
        "a": "go",
        "xp": "x0",
        "weights": {
          "s0": "1",
          "s1": "0"
        }
      },
      {
        "s": "s1",
        "x": "x0",
        "a": "go",
        "xp": "x1",
        "weights": {
          "s0": "1",
          "s1": "0"
        }
      },
      {
        "s": "s1",
        "x": "x1",
        "a": "go",
        "xp": "x0",
        "weights": {
          "s0": "0",
          "s1": "1"
        }
      },
      {
        "s": "s1",
        "x": "x1",
        "a": "go",
        "xp": "x1",
        "weights": {
          "s0": "0",
          "s1": "1"
        }
      }
    ]
  },
  "alternative": {
    "format": "Permansson.App.FiniteStrategicWorld.v1",
    "states": {
      "strategic": [
        "s0",
        "s1"
      ],
      "world": [
        "x0",
        "x1"
      ],
      "actions": [
        "go"
      ]
    },
    "feasible": [
      {
        "s": "s0",
        "x": "x0",
        "actions": [
          "go"
        ]
      },
      {
        "s": "s0",
        "x": "x1",
        "actions": [
          "go"
        ]
      },
      {
        "s": "s1",
        "x": "x0",
        "actions": [
          "go"
        ]
      },
      {
        "s": "s1",
        "x": "x1",
        "actions": [
          "go"
        ]
      }
    ],
    "alpha": [
      {
        "s": "s0",
        "x": "x0",
        "weights": {
          "go": "1"
        }
      },
      {
        "s": "s0",
        "x": "x1",
        "weights": {
          "go": "1"
        }
      },
      {
        "s": "s1",
        "x": "x0",
        "weights": {
          "go": "1"
        }
      },
      {
        "s": "s1",
        "x": "x1",
        "weights": {
          "go": "1"
        }
      }
    ],
    "P": [
      {
        "s": "s0",
        "x": "x0",
        "a": "go",
        "weights": {
          "x0": "1/2",
          "x1": "1/2"
        }
      },
      {
        "s": "s0",
        "x": "x1",
        "a": "go",
        "weights": {
          "x0": "1",
          "x1": "0"
        }
      },
      {
        "s": "s1",
        "x": "x0",
        "a": "go",
        "weights": {
          "x0": "0",
          "x1": "1"
        }
      },
      {
        "s": "s1",
        "x": "x1",
        "a": "go",
        "weights": {
          "x0": "0",
          "x1": "1"
        }
      }
    ],
    "U": [
      {
        "s": "s0",
        "x": "x0",
        "a": "go",
        "xp": "x0",
        "weights": {
          "s0": "1",
          "s1": "0"
        }
      },
      {
        "s": "s0",
        "x": "x0",
        "a": "go",
        "xp": "x1",
        "weights": {
          "s0": "1/2",
          "s1": "1/2"
        }
      },
      {
        "s": "s0",
        "x": "x1",
        "a": "go",
        "xp": "x0",
        "weights": {
          "s0": "0",
          "s1": "1"
        }
      },
      {
        "s": "s0",
        "x": "x1",
        "a": "go",
        "xp": "x1",
        "weights": {
          "s0": "0",
          "s1": "1"
        }
      },
      {
        "s": "s1",
        "x": "x0",
        "a": "go",
        "xp": "x0",
        "weights": {
          "s0": "1",
          "s1": "0"
        }
      },
      {
        "s": "s1",
        "x": "x0",
        "a": "go",
        "xp": "x1",
        "weights": {
          "s0": "1",
          "s1": "0"
        }
      },
      {
        "s": "s1",
        "x": "x1",
        "a": "go",
        "xp": "x0",
        "weights": {
          "s0": "0",
          "s1": "1"
        }
      },
      {
        "s": "s1",
        "x": "x1",
        "a": "go",
        "xp": "x1",
        "weights": {
          "s0": "0",
          "s1": "1"
        }
      }
    ]
  },
  "region": [
    [
      "s0",
      "x0"
    ],
    [
      "s0",
      "x1"
    ],
    [
      "s1",
      "x0"
    ]
  ],
  "initial_baseline": [
    "1",
    "0",
    "0",
    "0"
  ],
  "initial_alternative": [
    "3/4",
    "1/4",
    "0",
    "0"
  ],
  "horizon": 3
}
